{
  "$ref": "#/definitions/projects",
  "definitions": {
    "projects": {
      "type": "object",
      "properties": {
        "title": {
          "type": "string"
        },
        "tagline": {
          "type": "string"
        },
        "description": {
          "type": "string"
        },
        "status": {
          "type": "string",
          "enum": [
            "Active",
            "In Development",
            "On Hold",
            "Released"
          ]
        },
        "tags": {
          "type": "array",
          "items": {
            "type": "string"
          }
        },
        "url": {
          "type": "string"
        },
        "featured": {
          "type": "boolean",
          "default": false
        },
        "$schema": {
          "type": "string"
        }
      },
      "required": [
        "title",
        "tagline",
        "description",
        "status",
        "tags"
      ],
      "additionalProperties": false
    }
  },
  "$schema": "http://json-schema.org/draft-07/schema#"
}