{
  "title": "Dungeon Delvers",
  "tagline": "Descend together. Die together.",
  "description": "A fully 3D RPG for OSX, Windows, and Linux where players form parties to tackle procedurally generated dungeons teeming with demons and ancient evil. Battle in real-time, level up your character, craft gear, and forge alliances. Powered by a custom real-time single player architecture.",
  "status": "In Development",
  "tags": ["RPG", "3D", "Single Player", "OSX", "Windows", "Linux", "Real-time"],
  "featured": true
}
